{
  "schema_version": "2.1.0",
  "workflow_step": "earthquake_public_evidence_audit_run",
  "confirmed_building": {
    "display_name": "Fixture Reopened Mall",
    "candidate_id": "fixture-reopened-mall",
    "city": "Davao City",
    "country": "Philippines",
    "gate_1_status": "confirmed_by_user",
    "identity_confirmation_sources": [
      {"label": "LGU record fixture", "url": "https://example.com/lgu/fixture-reopened-mall", "use": "Exact target named in official record."}
    ]
  },
  "selected_earthquake_lanes": ["clearance_after_damage_or_tag"],
  "source_ingestion_policy": {
    "mode": "metadata_plus_short_snippets",
    "stored_fields": ["url", "source_label", "source_class", "date_or_freshness", "short_excerpt", "query_used", "lane_relevance"],
    "full_page_archive": false
  },
  "lane_packets": [
    {
      "lane_id": "clearance_after_damage_or_tag",
      "packet_ref": "evidence-packet-fixtures/official-clearance-found.json",
      "packet_result_status": "positive_evidence_found",
      "summary": "Target-specific official or professional clearance evidence was recorded with source URL and caveats.",
      "overclaim_status": "passed",
      "requires_manual_request": false
    }
  ],
  "overall_summary": {
    "status": "ready_for_operator_use",
    "source_bounded_summary": "The parent packet reports only the source-bounded clearance evidence found for the selected lane and does not generalize beyond that record.",
    "forbidden_conclusion_codes": ["earthquake_safe", "earthquake_unsafe", "general_compliance"]
  },
  "unresolved_cross_lane_exceptions": [
    {"exception_id": "clearance-scope-limited", "description": "The positive evidence applies only to the selected clearance lane and its stated date/scope.", "resolution_route": "Do not reuse the record for NSCP, OBO review, or general earthquake-readiness conclusions."}
  ],
  "final_overclaim_status": {
    "status": "passed",
    "checked_lane_ids": ["clearance_after_damage_or_tag"],
    "checklist": {
      "exact_building_match_confirmed": true,
      "each_lane_packet_audited": true,
      "parent_summary_audited": true,
      "missing_evidence_not_converted_to_conclusion": true,
      "unresolved_exceptions_preserved": true
    }
  }
}
