{
  "schema_version": "2.1.0",
  "workflow_step": "earthquake_public_evidence_audit_run",
  "confirmed_building": {
    "display_name": "KCC Mall of GenSan",
    "candidate_id": "fixture-kcc-gensan",
    "city": "General Santos",
    "country": "Philippines",
    "gate_1_status": "confirmed_by_user",
    "identity_confirmation_sources": [
      {"label": "Official mall page fixture", "url": "https://example.com/kcc-gensan", "use": "Exact mall name and city confirmation."}
    ]
  },
  "selected_earthquake_lanes": ["obo_structural_permit_review_evidence"],
  "source_ingestion_policy": {
    "mode": "metadata_plus_short_snippets",
    "stored_fields": ["url", "source_label", "source_class", "date_or_freshness", "short_excerpt", "query_used", "lane_relevance"],
    "full_page_archive": false
  },
  "lane_packets": [
    {
      "lane_id": "obo_structural_permit_review_evidence",
      "packet_ref": "evidence-packet-fixtures/no-public-evidence-obo-structural-review.json",
      "packet_result_status": "no_public_evidence_found",
      "summary": "No public evidence found for OBO structural permit or review evidence after the recorded searches.",
      "overclaim_status": "passed",
      "requires_manual_request": true
    }
  ],
  "overall_summary": {
    "status": "ready_for_operator_use",
    "source_bounded_summary": "The narrowed packet records public OBO structural review evidence availability and preserves the manual request route.",
    "forbidden_conclusion_codes": ["earthquake_safe", "earthquake_unsafe", "compliant", "noncompliant", "no_permit"]
  },
  "unresolved_cross_lane_exceptions": [
    {"exception_id": "obo-record-not-public", "description": "Target-specific structural review records may be held by the OBO or owner.", "resolution_route": "Request the OBO structural permit or review record."}
  ],
  "final_overclaim_status": {
    "status": "passed",
    "checked_lane_ids": ["obo_structural_permit_review_evidence"],
    "checklist": {
      "exact_building_match_confirmed": true,
      "each_lane_packet_audited": true,
      "parent_summary_audited": true,
      "missing_evidence_not_converted_to_conclusion": true,
      "unresolved_exceptions_preserved": true
    }
  }
}
