{
  "schema_version": "2.1.0",
  "workflow_step": "earthquake_public_evidence_audit_run",
  "confirmed_building": {
    "display_name": "Grand Summit Hotel General Santos",
    "candidate_id": "fixture-grand-summit-gensan",
    "city": "General Santos",
    "country": "Philippines",
    "gate_1_status": "confirmed_by_user",
    "identity_confirmation_sources": [
      {"label": "Hotel page fixture", "url": "https://example.com/grand-summit-gensan", "use": "Exact hotel identity confirmation."}
    ]
  },
  "selected_earthquake_lanes": ["post_earthquake_tag_status", "clearance_after_damage_or_tag"],
  "source_ingestion_policy": {
    "mode": "metadata_plus_short_snippets",
    "stored_fields": ["url", "source_label", "source_class", "date_or_freshness", "short_excerpt", "query_used", "lane_relevance"],
    "full_page_archive": false
  },
  "lane_packets": [
    {
      "lane_id": "post_earthquake_tag_status",
      "packet_ref": "evidence-packet-fixtures/no-public-answer-post-earthquake-tag.json",
      "packet_result_status": "no_public_answer_found",
      "summary": "No public answer found for latest post-earthquake tag or status after the recorded searches.",
      "overclaim_status": "passed",
      "requires_manual_request": true
    },
    {
      "lane_id": "clearance_after_damage_or_tag",
      "packet_ref": "evidence-packet-fixtures/no-public-answer-clearance.json",
      "packet_result_status": "no_public_answer_found",
      "summary": "No public answer found for latest clearance after damage or tag after the recorded searches.",
      "overclaim_status": "passed",
      "requires_manual_request": true
    }
  ],
  "overall_summary": {
    "status": "ready_for_operator_use",
    "source_bounded_summary": "The narrowed packet records that the public tag and clearance questions were searched and remain unresolved from public sources.",
    "forbidden_conclusion_codes": ["earthquake_safe", "earthquake_unsafe", "cleared", "no_tag"]
  },
  "unresolved_cross_lane_exceptions": [
    {"exception_id": "status-record-custodian-needed", "description": "Post-earthquake status and clearance records may be held by the LGU, CDRRMO, OBO, or owner.", "resolution_route": "Request the relevant inspection disposition and reoccupancy record."}
  ],
  "final_overclaim_status": {
    "status": "passed",
    "checked_lane_ids": ["post_earthquake_tag_status", "clearance_after_damage_or_tag"],
    "checklist": {
      "exact_building_match_confirmed": true,
      "each_lane_packet_audited": true,
      "parent_summary_audited": true,
      "missing_evidence_not_converted_to_conclusion": true,
      "unresolved_exceptions_preserved": true
    }
  }
}
